{
  "schema_version": "market-impact.method-quality-benchmark-registration.v1",
  "registered_at": "2026-08-27T00:00:00Z",
  "provider_profile_id": "model-provider-a37f1abb9efbdfb3aefa4fc7f1e4803e4ac0a14512e07b7788f19959e3b610c0",
  "provider_profile_hash": "a37f1abb9efbdfb3aefa4fc7f1e4803e4ac0a14512e07b7788f19959e3b610c0",
  "method_catalog_id": "research-method-catalog-2bea3e78b3d8af253a0d0baea5274a0b082501de551c6e7c7648bff1be6d31e0",
  "method_catalog_hash": "2bea3e78b3d8af253a0d0baea5274a0b082501de551c6e7c7648bff1be6d31e0",
  "immutable_prior_registration_ids": [
    "method-ablation-4a53646fb4698225414d0519387213d5ba679358baeb547ea4ba0e1f0c5454b9",
    "agent-study-0e5df98482c956d76b53f6330814dd287f692cf1328119b5678cb1a429ae1aaa"
  ],
  "development_case_count": 8,
  "retrospective_holdout_case_count": 24,
  "replicate_count": 5,
  "run_order": "interleaved_by_case_then_replicate_then_arm",
  "strata": [
    {
      "event_archetype": "physical_supply_logistics",
      "target_case_count": 8,
      "minimum_required_abstentions": 1
    },
    {
      "event_archetype": "issuer_corporate",
      "target_case_count": 4,
      "minimum_required_abstentions": 1
    },
    {
      "event_archetype": "macro_real_economy",
      "target_case_count": 3,
      "minimum_required_abstentions": 1
    },
    {
      "event_archetype": "policy_regulatory",
      "target_case_count": 3,
      "minimum_required_abstentions": 1
    },
    {
      "event_archetype": "geopolitical_security",
      "target_case_count": 3,
      "minimum_required_abstentions": 1
    },
    {
      "event_archetype": "financial_market_mechanics",
      "target_case_count": 3,
      "minimum_required_abstentions": 1
    }
  ],
  "suites": [
    {
      "suite_id": "general_methods",
      "arms": ["neutral_evidence", "general_methods", "general_pattern"],
      "eligible_archetypes": [
        "physical_supply_logistics",
        "issuer_corporate",
        "macro_real_economy",
        "policy_regulatory",
        "geopolitical_security",
        "financial_market_mechanics"
      ],
      "minimum_case_count": 24,
      "claim": "General research methods add cross-mechanism value beyond neutral evidence."
    },
    {
      "suite_id": "family_increment",
      "arms": [
        "neutral_evidence",
        "general_methods",
        "general_pattern",
        "family_guided"
      ],
      "eligible_archetypes": ["physical_supply_logistics"],
      "minimum_case_count": 8,
      "claim": "The physical-energy family method adds value beyond general methods and patterns."
    }
  ],
  "treatment_bindings": [
    {
      "suite_id": "general_methods",
      "arm": "neutral_evidence",
      "context": {"mechanism_family": "cross_mechanism_holdout", "asset_class": "public_equity", "has_pattern_pack": true},
      "route_id": "skill-route-6352513fe93931d5fa38f87789318a69bd0257ab14a520a5159d8171a66dd44c",
      "route_hash": "6352513fe93931d5fa38f87789318a69bd0257ab14a520a5159d8171a66dd44c",
      "requested_skills": ["evidence-core"],
      "loaded_skills": ["evidence-core"],
      "manifest_hashes": ["4bf3db546401a6cd5578f18fff6c379d4d3c41e65de5594944e22efe0a135933"],
      "instruction_hashes": ["7f79ff844f45de189387e1c0de767f834020b227c6a0dbbd3055c0c50f74de35"],
      "allowed_capabilities": ["evidence.read"],
      "allowed_tools": ["read_evidence"],
      "reasons": ["arm:neutral_evidence", "asset_class:public_equity", "mechanism_family:cross_mechanism_holdout", "pattern_pack:true"]
    },
    {
      "suite_id": "general_methods",
      "arm": "general_methods",
      "context": {"mechanism_family": "cross_mechanism_holdout", "asset_class": "public_equity", "has_pattern_pack": true},
      "route_id": "skill-route-e756a661f697af628cca17184e7dadefe132ab90ab957e52c7d01ec200df729d",
      "route_hash": "e756a661f697af628cca17184e7dadefe132ab90ab957e52c7d01ec200df729d",
      "requested_skills": ["evidence-core", "research-discipline", "event-market-context", "equity-exposure", "adversarial-risk"],
      "loaded_skills": ["evidence-core", "research-discipline", "event-market-context", "equity-exposure", "adversarial-risk"],
      "manifest_hashes": ["4bf3db546401a6cd5578f18fff6c379d4d3c41e65de5594944e22efe0a135933", "80a1793e5aeae766e1495a22d4f510f817b805597f823cebde3c2a64e3248488", "9dc4e6eae1d38cb6f8f5957fd13f58422c61c2ad6c5d20ccf47d73f0f7cfdbe3", "959db7c689d0d80fed2211eca82b7af2496b8c533bcd70fdfc1f9b0e7f6fff26", "7fea7a4b376e52ae5ae9413f0c57c7ea7a147be1d141f886515acbbc691f744d"],
      "instruction_hashes": ["7f79ff844f45de189387e1c0de767f834020b227c6a0dbbd3055c0c50f74de35", "8edc8ca30198ea60e6d4637c19f8290ec0c97a2aac2532f2d5b215bbe464927d", "0f02f42dadc2dff17bc6213cacf618b1fd96c88eb25efd3f4f91a942789bd03b", "77398abb5effddc46ee85dcd550433ea2c7af36a5318fdc704cc6d584b9ba549", "c1e8c71d474ff0231e5c2e7c08124dc860495de9635f216e0b176f01a95aaf75"],
      "allowed_capabilities": ["evidence.read"],
      "allowed_tools": ["read_evidence"],
      "reasons": ["arm:general_methods", "asset_class:public_equity", "mechanism_family:cross_mechanism_holdout", "pattern_pack:true"]
    },
    {
      "suite_id": "general_methods",
      "arm": "general_pattern",
      "context": {"mechanism_family": "cross_mechanism_holdout", "asset_class": "public_equity", "has_pattern_pack": true},
      "route_id": "skill-route-ab7b35a3af8a719c63ba3f3880597cfe0f11b382a8401cc1b0764f8b907f22eb",
      "route_hash": "ab7b35a3af8a719c63ba3f3880597cfe0f11b382a8401cc1b0764f8b907f22eb",
      "requested_skills": ["evidence-core", "research-discipline", "event-market-context", "equity-exposure", "adversarial-risk", "pattern-review"],
      "loaded_skills": ["evidence-core", "research-discipline", "event-market-context", "equity-exposure", "adversarial-risk", "pattern-review"],
      "manifest_hashes": ["4bf3db546401a6cd5578f18fff6c379d4d3c41e65de5594944e22efe0a135933", "80a1793e5aeae766e1495a22d4f510f817b805597f823cebde3c2a64e3248488", "9dc4e6eae1d38cb6f8f5957fd13f58422c61c2ad6c5d20ccf47d73f0f7cfdbe3", "959db7c689d0d80fed2211eca82b7af2496b8c533bcd70fdfc1f9b0e7f6fff26", "7fea7a4b376e52ae5ae9413f0c57c7ea7a147be1d141f886515acbbc691f744d", "9fd099d5f2596fe179ac6250ad4e6a6b19499c57c2d405646ba17674824c1c11"],
      "instruction_hashes": ["7f79ff844f45de189387e1c0de767f834020b227c6a0dbbd3055c0c50f74de35", "8edc8ca30198ea60e6d4637c19f8290ec0c97a2aac2532f2d5b215bbe464927d", "0f02f42dadc2dff17bc6213cacf618b1fd96c88eb25efd3f4f91a942789bd03b", "77398abb5effddc46ee85dcd550433ea2c7af36a5318fdc704cc6d584b9ba549", "c1e8c71d474ff0231e5c2e7c08124dc860495de9635f216e0b176f01a95aaf75", "78a7fca139693db52b1b5320cbca19e50bb227a8e27a36bee9133ed2694c0a74"],
      "allowed_capabilities": ["evidence.read", "pattern.read"],
      "allowed_tools": ["read_evidence", "read_pattern_pack"],
      "reasons": ["arm:general_pattern", "asset_class:public_equity", "mechanism_family:cross_mechanism_holdout", "pattern_pack:true"]
    },
    {
      "suite_id": "family_increment",
      "arm": "neutral_evidence",
      "context": {"mechanism_family": "physical_energy_supply_shock", "asset_class": "public_equity", "has_pattern_pack": true},
      "route_id": "skill-route-23c29f78c9d72a0d7ce5badfdabe9c0a4692be42bc1316da638bb43a9f4c3ce1",
      "route_hash": "23c29f78c9d72a0d7ce5badfdabe9c0a4692be42bc1316da638bb43a9f4c3ce1",
      "requested_skills": ["evidence-core"],
      "loaded_skills": ["evidence-core"],
      "manifest_hashes": ["4bf3db546401a6cd5578f18fff6c379d4d3c41e65de5594944e22efe0a135933"],
      "instruction_hashes": ["7f79ff844f45de189387e1c0de767f834020b227c6a0dbbd3055c0c50f74de35"],
      "allowed_capabilities": ["evidence.read"],
      "allowed_tools": ["read_evidence"],
      "reasons": ["arm:neutral_evidence", "asset_class:public_equity", "mechanism_family:physical_energy_supply_shock", "pattern_pack:true"]
    },
    {
      "suite_id": "family_increment",
      "arm": "general_methods",
      "context": {"mechanism_family": "physical_energy_supply_shock", "asset_class": "public_equity", "has_pattern_pack": true},
      "route_id": "skill-route-0da98cb9bd36553d356098fa7f8e619e7003442f4c8cfcf090671e6ac9ab3e4d",
      "route_hash": "0da98cb9bd36553d356098fa7f8e619e7003442f4c8cfcf090671e6ac9ab3e4d",
      "requested_skills": ["evidence-core", "research-discipline", "event-market-context", "equity-exposure", "adversarial-risk"],
      "loaded_skills": ["evidence-core", "research-discipline", "event-market-context", "equity-exposure", "adversarial-risk"],
      "manifest_hashes": ["4bf3db546401a6cd5578f18fff6c379d4d3c41e65de5594944e22efe0a135933", "80a1793e5aeae766e1495a22d4f510f817b805597f823cebde3c2a64e3248488", "9dc4e6eae1d38cb6f8f5957fd13f58422c61c2ad6c5d20ccf47d73f0f7cfdbe3", "959db7c689d0d80fed2211eca82b7af2496b8c533bcd70fdfc1f9b0e7f6fff26", "7fea7a4b376e52ae5ae9413f0c57c7ea7a147be1d141f886515acbbc691f744d"],
      "instruction_hashes": ["7f79ff844f45de189387e1c0de767f834020b227c6a0dbbd3055c0c50f74de35", "8edc8ca30198ea60e6d4637c19f8290ec0c97a2aac2532f2d5b215bbe464927d", "0f02f42dadc2dff17bc6213cacf618b1fd96c88eb25efd3f4f91a942789bd03b", "77398abb5effddc46ee85dcd550433ea2c7af36a5318fdc704cc6d584b9ba549", "c1e8c71d474ff0231e5c2e7c08124dc860495de9635f216e0b176f01a95aaf75"],
      "allowed_capabilities": ["evidence.read"],
      "allowed_tools": ["read_evidence"],
      "reasons": ["arm:general_methods", "asset_class:public_equity", "mechanism_family:physical_energy_supply_shock", "pattern_pack:true"]
    },
    {
      "suite_id": "family_increment",
      "arm": "general_pattern",
      "context": {"mechanism_family": "physical_energy_supply_shock", "asset_class": "public_equity", "has_pattern_pack": true},
      "route_id": "skill-route-63a163d0a69f63f234c6a6c4f40a917c1da2de776c2fae1ab6e1325d5f60b4f7",
      "route_hash": "63a163d0a69f63f234c6a6c4f40a917c1da2de776c2fae1ab6e1325d5f60b4f7",